id, compliance, chapter, chapter_small, title, section, description, non_existant_risk, inneffective_risk, partially_effective_risk, effective_risk
"1","ISO 27001","Organization of Information Security","ISO Chapter A.6","Segregation of duties","A.6.1.2","Conflicting duties and areas of responsibility shall be segregated to reduce opportunities for unauthorized or unintentional modification or misuse of the organization’s assets.","High","Medium","Low","Ok"
"2","ISO 27001","Organization of Information Security","ISO Chapter A.6","Infromation security in project management","A.6.1.5","Information security should be addressed in project management, regardless of the type of the project","High","Medium","Low","Ok"
"3","ISO 27001","Organization of Information Security","ISO Chapter A.6","Mobile Device Policy","A.6.2.1","A policy and supporting security measures shall be adopted to manage the risks introduced by using mobile devices.","High","Medium","Low","Ok"
"4","ISO 27001","Human Resources Security","ISO Chapter A.7","Screening","A.7.1.1","Background verification checks on all candidates for employment shall be carried out in accordance with relevant laws, regulations and ethics and shall be proportional to the business requirements, the classification of the information to be accessed and the perceived risks. ","High","Medium","Low","Ok"
"5","ISO 27001","Human Resources Security","ISO Chapter A.7","Management responsibilities","A.7.2.1","Management shall require all employees and contractors to apply information security in accordance with the established policies and procedures of the organization.","High","Medium","Low","Ok"
"6","ISO 27001","Human Resources Security","ISO Chapter A.7","Information security awareness, education and training","A.7.2.2","All employees of the organization and, where relevant, contractors shall receive appropriate awareness education and training and regular updates in organizational policies and procedures, as relevant for their job function.","High","Medium","Low","Ok"
"7","ISO 27001","Human Resources Security","ISO Chapter A.7","Termination or change of employment responsibilities","A.7.3.1","Information security responsibilities and duties that remain valid after termination or change of employment shall be defined, communicated to the employee or contractor and enforced.","High","Medium","Low","Ok"
"8","ISO 27001","Asset Management","ISO Chapter A.8","Inventory of Assets","A.8.1.1","Assets associated with information and information processing facilities shall be identified and an inventory of these assets shall be drawn up and maintained.","High","Medium","Low","Ok"
"9","ISO 27001","Asset Management","ISO Chapter A.8","Ownership of Assets","A.8.1.2","Assets maintained in the inventory shall be owned.","High","Medium","Low","Ok"
"10","ISO 27001","Asset Management","ISO Chapter A.8","Acceptable use of Assets","A.8.1.3","Rules for the acceptable use of information and of assets associated with information and information processing facilities shall be identified, documented and implemented.","High","Medium","Low","Ok"
"11","ISO 27001","Asset Management","ISO Chapter A.8","Return of Assets","A.8.1.4","All employees and external party users shall return all of the organizational assets in their possession upon termination of their employment, contract or agreement.","High","Medium","Low","Ok"
"12","ISO 27001","Asset Management","ISO Chapter A.8","Classification of information","A.8.2.1","Information shall be classified in terms of legal requirements, value, criticality and sensitivity to unauthorized disclosure or modification.","High","Medium","Low","Ok"
"13","ISO 27001","Asset Management","ISO Chapter A.8","Labelling of information","A.8.2.2","An appropriate set of procedures for information labelling shall be developed and implemented in accordance with the information classification scheme adopted by the organization.","High","Medium","Low","Ok"
"14","ISO 27001","Asset Management","ISO Chapter A.8","Handling of assets","A.8.2.3","Procedures for handling assets shall be developed and implemented in accordance with the information classification scheme adopted by the organization.","High","Medium","Low","Ok"
"15","ISO 27001","Asset Management","ISO Chapter A.8","Management of removable media","A.8.3.1","Procedures shall be implemented for the management of removable media* in accordance with the classification scheme adopted by the organization.  *any type of storage device that can be removed from a computer while the system is running (e.g. DVD, BR, USB drives…)","High","Medium","Low","Ok"
"16","ISO 27001","Asset Management","ISO Chapter A.8","Disposal of media","A.8.3.2","Media shall be disposed of securely when no longer required, using formal procedures.","High","Medium","Low","Ok"
"17","ISO 27001","Asset Management","ISO Chapter A.8","Physical media transfer","A.8.3.3","Media containing information shall be protected against unauthorized access, misuse or corruption during transportation.","High","Medium","Low","Ok"
"18","ISO 27001","Access Control","ISO Chapter A.9","Access to networks and network services","A.9.1.2","Users shall only be provided with access to the network and network services that they have been specifically authorized to use.","High","Medium","Low","Ok"
"19","ISO 27001","Access Control","ISO Chapter A.9","User registration and de-registration","A.9.2.1","A formal user registration and de-registration process shall be implemented to enable assignment of access rights.","High","Medium","Low","Ok"
"20","ISO 27001","Access Control","ISO Chapter A.9","User access provisioning","A.9.2.2","A formal user access provisioning process shall be implemented to assign or revoke user access rights to systems and services.","High","Medium","Low","Ok"
"21","ISO 27001","Access Control","ISO Chapter A.9","Management of privileged access rights","A.9.2.3","The allocation and use of privileged access rights shall be restricted and controlled.","High","Medium","Low","Ok"
"22","ISO 27001","Access Control","ISO Chapter A.9","Management of secret authentication information of users","A.9.2.4","The allocation of secret authentication information shall be controlled through a formal management process.","High","Medium","Low","Ok"
"23","ISO 27001","Access Control","ISO Chapter A.9","Review of user access rights","A.9.2.5","Asset owners shall review users’ access rights at regular intervals.","High","Medium","Low","Ok"
"24","ISO 27001","Access Control","ISO Chapter A.9","Removal or adjustment of access rights","A.9.2.6","The access rights of all employees and external party users to information and information processing facilities shall be removed upon termination of their employment, contract or agreement, or adjusted upon change.","High","Medium","Low","Ok"
"25","ISO 27001","Access Control","ISO Chapter A.9","Information access restriction","A.9.4.1","Access to information and application system functions shall be restricted in accordance with the access control policy.","High","Medium","Low","Ok"
"26","ISO 27001","Access Control","ISO Chapter A.9","Secure log-on procedures","A.9.4.2","Where required by the access control policy, access to systems and applications shall be controlled by a secure log-on procedure.","High","Medium","Low","Ok"
"27","ISO 27001","Access Control","ISO Chapter A.9","Password management system","A.9.4.3","Password management systems shall be interactive and shall ensure quality passwords.","High","Medium","Low","Ok"
"28","ISO 27001","Access Control","ISO Chapter A.9","Use of privileged utility programs","A.9.4.4","The use of utility programs that might be capable of overriding system and application controls shall be restricted and tightly controlled.","High","Medium","Low","Ok"
"29","ISO 27001","Access Control","ISO Chapter A.9","Access control to program source code","A.9.4.5","Access to program source code shall be restricted.","High","Medium","Low","Ok"
"30","ISO 27001","Cryptography","ISO Chapter A.10","Policy on the use of cryptographic controls","A.10.1.1","A policy on the use of cryptographic controls for protection of information shall be developed and implemented.","High","Medium","Low","Ok"
"31","ISO 27001","Cryptography","ISO Chapter A.10","Key management","A.10.1.2","A policy on the use, protection and lifetime of cryptographic keys shall be developed and implemented through their whole lifecycle.","High","Medium","Low","Ok"
"32","ISO 27001","Physical and Environmental Security","ISO Chapter A.11","Physical security perimeter","A.11.1.1","Security perimeters shall be defined and used to protect areas that contain either sensitive or critical information and information processing facilities.","High","Medium","Low","Ok"
"33","ISO 27001","Physical and Environmental Security","ISO Chapter A.11","Physical entry controls","A.11.1.2","Secure areas shall be protected by appropriate entry controls to ensure that only authorized personnel are allowed access.","High","Medium","Low","Ok"
"34","ISO 27001","Physical and Environmental Security","ISO Chapter A.11","Securing offices rooms and facilities","A.11.1.3","Physical security for offices, rooms and facilities shall be designed and applied.","High","Medium","Low","Ok"
"35","ISO 27001","Physical and Environmental Security","ISO Chapter A.11","Protecting against external and environmental threats","A.11.1.4","Physical protection against natural disasters, malicious attack or accidents shall be designed and applied.","High","Medium","Low","Ok"
"36","ISO 27001","Physical and Environmental Security","ISO Chapter A.11","Working in secure areas","A.11.1.5","Procedures for working in secure areas shall be designed and applied.","High","Medium","Low","Ok"
"37","ISO 27001","Physical and Environmental Security","ISO Chapter A.11","Delivery and loading areas","A.11.1.6","Access points such as delivery and loading areas and other points where unauthorized persons could enter the premises shall be controlled and, if possible, isolated from information processing facilities to avoid unauthorized access.","High","Medium","Low","Ok"
"38","ISO 27001","Physical and Environmental Security","ISO Chapter A.11","Equipment siting and protection","A.11.2.1","Equipment shall be sited and protected to reduce the risks from environmental threats and hazards, and opportunities for unauthorized access.","High","Medium","Low","Ok"
"39","ISO 27001","Physical and Environmental Security","ISO Chapter A.11","Supporting utilities","A.11.2.2","Equipment shall be protected from power failures and other disruptions caused by failures in supporting utilities.","High","Medium","Low","Ok"
"40","ISO 27001","Physical and Environmental Security","ISO Chapter A.11","Cabling security","A.11.2.3","Power and telecommunications cabling carrying data or supporting information services shall be protected from interception, interference or damage.","High","Medium","Low","Ok"
"41","ISO 27001","Physical and Environmental Security","ISO Chapter A.11","Equipment maintenance","A.11.2.4","Equipment shall be correctly maintained to ensure its continued availability and integrity.","High","Medium","Low","Ok"
"42","ISO 27001","Physical and Environmental Security","ISO Chapter A.11","Removal of assets","A.11.2.5","Equipment, information or software shall not be taken off-site without prior authorization.","High","Medium","Low","Ok"
"43","ISO 27001","Physical and Environmental Security","ISO Chapter A.11","Security of equipment and assets off premises","A.11.2.6","Security shall be applied to off-site assets taking into account the different risks of working outside the organization's premises","High","Medium","Low","Ok"
"44","ISO 27001","Physical and Environmental Security","ISO Chapter A.11","Secure Disposal or reuse of equipment","A.11.2.7","All items of equipment containing storage media shall be verified to ensure that any sensitive data and licensed software has been removed or securely overwritten prior to disposal or re-use.","High","Medium","Low","Ok"
"45","ISO 27001","Physical and Environmental Security","ISO Chapter A.11","Unattended user equipment","A.11.2.8","Users shall ensure that unattended equipment has appropriate protection.","High","Medium","Low","Ok"
"46","ISO 27001","Physical and Environmental Security","ISO Chapter A.11","Clear desk and screen policy","A.11.2.9","A clear desk policy for papers and removable storage media and a clear screen policy for information processing facilities shall be adopted.","High","Medium","Low","Ok"
"47","ISO 27001","Operations Security","ISO Chapter A.12","Change Management","A.12.1.2","Changes to the organization, business processes, information processing facilities and systems that affect information security shall be controlled.","High","Medium","Low","Ok"
"48","ISO 27001","Operations Security","ISO Chapter A.12","Capacity Management","A.12.1.3","The use of resources shall be monitored, tuned and projections made of future capacity requirements to ensure the required system performance.","High","Medium","Low","Ok"
"49","ISO 27001","Operations Security","ISO Chapter A.12","Separation of development, testing and operational environments","A.12.1.4","Development, testing, and operational environments shall be separated to reduce the risks of unauthorized access or changes to the operational environment.","High","Medium","Low","Ok"
"50","ISO 27001","Operations Security","ISO Chapter A.12","Controls against Malware","A.12.2.1","Detection, prevention and recovery controls to protect against malware shall be implemented.","High","Medium","Low","Ok"
"51","ISO 27001","Operations Security","ISO Chapter A.12","Information Backup","A.12.3.1","Backup copies of information, software and system images shall be taken and tested regularly in accordance with an agreed backup policy.","High","Medium","Low","Ok"
"52","ISO 27001","Operations Security","ISO Chapter A.12","Event logging","A.12.4.1","Event logs recording user activities, exceptions, faults and information security events shall be produced, kept and regularly reviewed.","High","Medium","Low","Ok"
"53","ISO 27001","Operations Security","ISO Chapter A.12","Protection of log information","A.12.4.2","Logging facilities and log information shall be protected against tampering and unauthorized access.","High","Medium","Low","Ok"
"54","ISO 27001","Operations Security","ISO Chapter A.12","Administrator and Operator Logs","A.12.4.3","System administrator and system operator activities shall be logged and the logs protected and regularly reviewed.","High","Medium","Low","Ok"
"55","ISO 27001","Operations Security","ISO Chapter A.12","Clock Synchronisation","A.12.4.4","The clocks of all relevant information processing systems within an organization or security domain shall be synchronised to a single reference time source.","High","Medium","Low","Ok"
"56","ISO 27001","Operations Security","ISO Chapter A.12","Installation of software on operational systems","A.12.5.1","Procedures shall be implemented to control the installation of software on operational systems.","High","Medium","Low","Ok"
"57","ISO 27001","Operations Security","ISO Chapter A.12","Management of technical vulnerabilities","A.12.6.1","Information about technical vulnerabilities of information systems being used shall be obtained in a timely fashion, the organization’s exposure to such vulnerabilities evaluated and appropriate measures taken to address the associated risk.","High","Medium","Low","Ok"
"58","ISO 27001","Operations Security","ISO Chapter A.12","Restrictions on software installation","A.12.6.2","Rules governing the installation of software by users shall be established and implemented.","High","Medium","Low","Ok"
"59","ISO 27001","Operations Security","ISO Chapter A.12","Information systems audit controls","A.12.7.1","Audit requirements and activities involving verification of operational systems shall be carefully planned and agreed to minimise disruptions to business processes.","High","Medium","Low","Ok"
"60","ISO 27001","Communications Security","ISO Chapter A.13","Network Controls","A.13.1.1","Networks shall be managed and controlled to protect information in systems and applications.","High","Medium","Low","Ok"
"61","ISO 27001","Communications Security","ISO Chapter A.13","Security of Network Services","A.13.1.2","Security mechanisms, service levels and management requirements of all network services shall be identified and included in network services agreements, whether these services are provided in-house or outsourced.","High","Medium","Low","Ok"
"62","ISO 27001","Communications Security","ISO Chapter A.13","Segregation in Networks","A.13.1.3","Groups of information services, users and information systems shall be segregated on networks.","High","Medium","Low","Ok"
"63","ISO 27001","Communications Security","ISO Chapter A.13","Information transfer policies and procedures","A.13.2.1","Formal transfer policies, procedures and controls shall be in place to protect the transfer of information through the use of all types of communication facilities.","High","Medium","Low","Ok"
"64","ISO 27001","Communications Security","ISO Chapter A.13","Electronic messaging","A.13.2.3","Information involved in electronic messaging shall be appropriately protected.","High","Medium","Low","Ok"
"65","ISO 27001","System Acquisition, Development and Maintenance","ISO Chapter A.14","Information security requirements analysis and specification","A.14.1.1","The information security related requirements shall be included in the requirements for new information systems or enhancements to existing information systems.","High","Medium","Low","Ok"
"66","ISO 27001","System Acquisition, Development and Maintenance","ISO Chapter A.14","Securing application services on public networks","A.14.1.2","Information involved in application services passing over public networks shall be protected from fraudulent activity, contract dispute and unauthorized disclosure and modification.","High","Medium","Low","Ok"
"67","ISO 27001","System Acquisition, Development and Maintenance","ISO Chapter A.14","Protecting application services transactions","A.14.1.3","Information involved in application service transactions shall be protected to prevent incomplete transmission, mis-routing, unauthorized message alteration, unauthorized disclosure, unauthorized message duplication or replay.","High","Medium","Low","Ok"
"68","ISO 27001","System Acquisition, Development and Maintenance","ISO Chapter A.14","Secure development policy","A.14.2.1","Rules for the development of software and systems shall be established and applied to developments within the organization.","High","Medium","Low","Ok"
"69","ISO 27001","System Acquisition, Development and Maintenance","ISO Chapter A.14","System change control procedures","A.14.2.2","Changes to systems within the development lifecycle shall be controlled by the use of formal change control procedures.","High","Medium","Low","Ok"
"70","ISO 27001","System Acquisition, Development and Maintenance","ISO Chapter A.14","Technical review of applications after operating platform changes","A.14.2.3","When operating platforms are changed, business critical applications shall be reviewed and tested to ensure there is no adverse impact on organizational operations or security.","High","Medium","Low","Ok"
"71","ISO 27001","System Acquisition, Development and Maintenance","ISO Chapter A.14","Restrictions on changes to software packages","A.14.2.4","Modifications to software packages* shall be discouraged, limited to necessary changes and all changes shall be strictly controlled.  *Software package includes vendor-supplied and 3rd party software package","High","Medium","Low","Ok"
"72","ISO 27001","System Acquisition, Development and Maintenance","ISO Chapter A.14","Secure system engineering principles","A.14.2.5","Principles for engineering secure systems shall be established, documented, maintained and applied to any information systems implementation efforts. ","High","Medium","Low","Ok"
"73","ISO 27001","System Acquisition, Development and Maintenance","ISO Chapter A.14","Secure development environment","A.14.2.6","Organizations shall establish and appropriately protect secure development environments for system development and integration efforts that cover the entire system development lifecycle.","High","Medium","Low","Ok"
"74","ISO 27001","System Acquisition, Development and Maintenance","ISO Chapter A.14","Outsourced development","A.14.2.7","The organization shall supervise and monitor the activity of outsourced system development.","High","Medium","Low","Ok"
"75","ISO 27001","System Acquisition, Development and Maintenance","ISO Chapter A.14","System security testing","A.14.2.8","Testing of security functionality shall be carried out during development.","High","Medium","Low","Ok"
"76","ISO 27001","System Acquisition, Development and Maintenance","ISO Chapter A.14","System acceptance testing","A.14.2.9","Acceptance testing programs and related criteria shall be established for new information systems, upgrades and new versions.","High","Medium","Low","Ok"
"77","ISO 27001","System Acquisition, Development and Maintenance","ISO Chapter A.14","Protection of test data","A.14.3.1","Test data shall be selected carefully, protected and controlled.","High","Medium","Low","Ok"
"78","ISO 27001","Supplier Relationships","ISO Chapter A.15","Addressing security within supplier agreements","A.15.1.2","All relevant information security requirements shall be established and agreed with each supplier that may access, process, store, communicate, or provide IT infrastructure components for the organization’s information.","High","Medium","Low","Ok"
"79","ISO 27001","Supplier Relationships","ISO Chapter A.15","Information and communication technology supply chain","A.15.1.3","Agreements with suppliers shall include requirements to address the information security risks associated with information and communications technology services and product supply chain.","High","Medium","Low","Ok"
"80","ISO 27001","Supplier Relationships","ISO Chapter A.15","Monitoring and review of supplier services","A.15.2.1","Organizations shall regularly monitor, review and audit supplier service delivery.","High","Medium","Low","Ok"
"81","ISO 27001","Information Security Incident Management","ISO Chapter A.16","Reporting information security events","A.16.1.2","Information security events shall be reported through appropriate management channels as quickly as possible.","High","Medium","Low","Ok"
"82","ISO 27001","Information Security Incident Management","ISO Chapter A.16","Reporting information security weaknesses","A.16.1.3","Employees and contractors using the organization’s information systems and services shall be required to note and report any observed or suspected information security weaknesses in systems or services.","High","Medium","Low","Ok"
"83","ISO 27001","Information Security Incident Management","ISO Chapter A.16","Assessment of and decision on information security events","A.16.1.4","Information security events shall be assessed and it shall be decided if they are to be classified as information security incidents.","High","Medium","Low","Ok"
"84","ISO 27001","Information Security Incident Management","ISO Chapter A.16","Response to information security incidents","A.16.1.5","Information security incidents shall be responded to in accordance with the documented procedures.","High","Medium","Low","Ok"
"85","ISO 27001","Information Security Incident Management","ISO Chapter A.16","Learning from information security incidents","A.16.1.6","Knowledge gained from analyzing and resolving information security incidents shall be used to reduce the likelihood or impact of future incidents.","High","Medium","Low","Ok"
"86","ISO 27001","Information Security Incident Management","ISO Chapter A.16","Collection of evidence","A.16.1.7","The organization shall define and apply procedures for the identification, collection, acquisition and preservation of information, which can serve as evidence.","High","Medium","Low","Ok"
"87","ISO 27001","Information Security Aspects of Business Continuity Management","ISO Chapter A.17","Implementing information security continuity","A.17.1.2","The organization shall establish, document, implement and maintain processes, procedures and controls to ensure the required level of continuity for information security during an adverse situation.","High","Medium","Low","Ok"
"88","ISO 27001","Information Security Aspects of Business Continuity Management","ISO Chapter A.17","Verify, review and evaluate information security continuity","A.17.1.3","The organization shall verify the established and implemented information security continuity controls at regular intervals in order to ensure that they are valid and effective during adverse situations.","High","Medium","Low","Ok"
"89","ISO 27001","Information Security Aspects of Business Continuity Management","ISO Chapter A.17","Availability of information processing facilities","A.17.2.1","Information processing facilities shall be implemented with redundancy sufficient to meet availability requirements.","High","Medium","Low","Ok"
"90","ISO 27001","Compliance","ISO Chapter A.18","Intellectual property rights","A.18.1.2","Appropriate procedures shall be implemented to ensure compliance with legislative, regulatory and contractual requirements related to intellectual property rights and use of proprietary software products.","High","Medium","Low","Ok"
"91","ISO 27001","Compliance","ISO Chapter A.18","Protection of records","A.18.1.3","Records shall be protected from loss, destruction, falsification, unauthorized access and unauthorized release, in accordance with legislator, regulatory, contractual and business requirements.","High","Medium","Low","Ok"
